SELECT
SELECT * FROM pirnid ORDER BY 3;
SELET pirnisort, p3 FROM pirnid
SELECT pirnisort, p3 FROM pirnid
SELECT pirnisort, 3.14*r3*r3 AS ristloikepindala FROM pirnid
;
SELECT pirnisort, r3-r2 AS raadiustevahe FROM pirnid
;
SELECT pirnisort, p3-p2 AS vahe FROM pirnid
;
SELECT *, r3-r2 FROM pirnid
;
SELECT*, r2-r1/p2 FROM pirnid;
SELECT*, (r1-r2)/(p3-p2) FROM pirnid;
SELECT *, (r3-r2)/(p3-p2) - (r2-r1)/p2 FROM pirnid
;
SELECT *, BY ORDER id FROM pirnid
;
SELECT * Pirnid
SELECT * from PIRNID
;
CREATE TABLE Planeedid
(id INT NOT NULL AUTO_INCREMENT PRIMARY KEY,
Planeet VARCHAR(30),
r1 FLOAT,
p2 FLOAT,
r2 FLOAT,
p3 FLOAT,
r3 FLOAT,
);
CREATE TABLE Planeedid (id INT NOT NULL AUTO_INCREMENT PRIMARY KEY, Planeet VARCHAR(30), r1 FLOAT, p2 FLOAT, r2 FLOAT, p3 FLOAT, r3 FLOAT, );
CREATE TABLE planeedid(
id INT NOT NULL AUTO_INCREMENT PRIMARY KEY,
planeet VARCHAR(30)
mass FLOAT,
suurus FLOAT,
päeva pikkus FLOAT,
pinnatemp FLOAT,
kauguspäikesest FLOAT,
);
CREATE TABLE planeedid( id INT NOT NULL AUTO_INCREMENT PRIMARY KEY, planeet VARCHAR(30) mass FLOAT, suurus FLOAT, päeva pikkus FLOAT, pinnatemp FLOAT, kauguspäikesest FLOAT, );
CREATE TABLE pirnid(
id INT NOT NULL AUTO_INCREMENT PRIMARY KEY,
pirnisort VARCHAR(30),
r1 FLOAT,
p2 FLOAT,
r2 FLOAT,
p3 FLOAT,
kauguspäikesest FLOAT,
CREATE TABLE valgus(
id INT NOT NULL AUTO_INCREMENT PRIMARY KEY,
pirnisort VARCHAR(30),
W FLOAT,
V FLOAT,
lx FLOAT,
A FLOAT,
h FLOAT
);
CREATE TABLE valgus( id INT NOT NULL AUTO_INCREMENT PRIMARY KEY, pirnisort VARCHAR(30), W FLOAT, V FLOAT, lx FLOAT, A FLOAT, h FLOAT );
SELECT * FROM valgus
;
INSERT INTO Valgus VALUES (DEFAULT, 'Luminofoor', 28, 230, 142, 0.1, 4000);
INSERT INTO Valgus VALUES (DEFAULT, 'LED', 6.5, 230, 62, 0.03, 25 000);
INSERT INTO pirnid VALUES (DEFAULT, 'Hõõg', 40, 230, 144, 4, 1000);
INSERT INTO valgus VALUES (DEFAULT, 'Luminofoor', 28, 230, 142, 0.1, 4000);
INSERT INTO valgus VALUES (DEFAULT, 'LED', 6.5, 230, 62, 0.03, 25 000);
INSERT INTO valgus VALUES (DEFAULT, 'Hõõg', 40, 230, 144, 4, 1000);
SELECT * FROM valgus
;
describe valgus
;
INSERT INTO valgus VALUES (DEFAULT, 'LED', 6.5, 230, 62, 0.03, 25000);
SELECT * FROM valgus
;
INSERT INTO planeedid VALUES (DEFAULT, 'Veenus', 4.8, 12104, 8.9, 2802, 224, 35);
SELECT*FROM planeedid
;
DELETE FROM planeedid WHERE ID 2,3,5,6,7;
DELETE FROM planeedid WHERE ID=2,3,5,6,7;
DELETE TABLE planeedid;
DELETE FROM planeedid WHERE ID=2-7;
SELECT * FROM planeedid
;
DELETE planeedid
;
CREATE TABLE päikesesüsteem(
id INT NOT NULL AUTO_INCREMENT PRIMARY KEY,
planeet VARCHAR(30),
M FLOAT,
d FLOAT,
G FLOAT,
P FLOAT,
Y FLOAT,
k FLOAT
);
CREATE TABLE päikesesüsteem( id INT NOT NULL AUTO_INCREMENT PRIMARY KEY, planeet VARCHAR(30), M FLOAT, d FLOAT, G FLOAT, P FLOAT, Y FLOAT, k FLOAT );
INSERT INTO päikesesüsteem VALUES (DEFAULT, 'Maa', 5.97, 12756, 9.8, 24, 365, 29);
INSERT INTO päikesesüsteem VALUES (DEFAULT, 'Merkuur', 0.3, 4879, 3.7, 4222, 88, 47);
INSERT INTO päikesesüsteem VALUES (DEFAULT, 'Veenus', 4.8, 12104, 8.9, 2802, 224, 35);
INSERT INTO päikesesüsteem VALUES (DEFAULT, 'Mars', 0.642, 6792, 3.7, 25, 687, 24);
INSERT INTO päikesesüsteem VALUES (DEFAULT, 'Jupiter', 1898, 142984, 23.1, 9, 4331, 13);
SELECT * FROM päikesesüsteem
;
SELECT * FROM päikesesüsteem WHERE d>12.756;
SELECT * FROM päikesesüsteem WHERE d>12756;
mysql> SELECT * FROM päikesesüsteem WHERE d>12756;
+----+---------+------+--------+------+------+------+------+
| id | planeet | M    | d      | G    | P    | Y    | k    |
+----+---------+------+--------+------+------+------+------+
|  5 | Jupiter | 1898 | 142984 | 23.1 |    9 | 4331 |   13 |
+----+---------+------+--------+------+------+------+------+
1 row in set (0.00 sec)
;
+----+---------+------+--------+------+------+------+------+ | id | planeet | M    | d      | G    | P    | Y    | k    | +----+---------+------+--------+------+------+------+------+ |  5 | Jupiter | 1898 | 142984 | 23.1 |    9 | 4331 |   13 | +----+---------+------+--------+------+------+------+------+ 1 row in set (0.00 sec);
SELECT ID, (4/3)*3.14*((d/2)*(d/2)*(d/2)) FROM päikesesüsteem
;
mysql> SELECT ID, (4/3)*3.14*((d/2)*(d/2)*(d/2)) FROM päikesesüsteem
    -> ;
mysql> SELECT ID, (4/3)*3.14*((d/2)*(d/2)*(d/2)) FROM päikesesüsteem     ->;
+----+--------------------------------+
| ID | (4/3)*3.14*((d/2)*(d/2)*(d/2)) |
+----+--------------------------------+
|  1 |             1086230340471.4823 |
|  2 |              60781421384.54797 |
|  3 |              928036681886.8175 |
|  4 |             163972655221.72684 |
|  5 |             1529821374876627.8 |
+----+--------------------------------+
5 rows in set (0.00 sec)
;
+----+--------------------------------+ | ID | (4/3)*3.14*((d/2)*(d/2)*(d/2)) | +----+--------------------------------+ |  1 |             1086230340471.4823 | |  2 |              60781421384.54797 | |  3 |              928036681886.8175 | |  4 |             163972655221.72684 | |  5 |             1529821374876627.8 | +----+--------------------------------+ 5 rows in set (0.00 sec);
SELECT ID, m/((4/3)*3.14*((d/2)*(d/2)*(d/2))) FROM päikesesüsteem;
SELECT ID, M/((4/3)*3.14*((d/2)*(d/2)*(d/2))) FROM päikesesüsteem;
mysql> SELECT ID, M/((4/3)*3.14*((d/2)*(d/2)*(d/2))) FROM päikesesüsteem;
+----+------------------------------------+
| ID | M/((4/3)*3.14*((d/2)*(d/2)*(d/2))) |
+----+------------------------------------+
|  1 |      0.000000000005496071659718463 |
|  2 |      0.000000000004935718926724471 |
|  3 |      0.000000000005172209552079178 |
|  4 |      0.000000000003915287086631605 |
|  5 |      0.000000000001240667721846326 |
+----+------------------------------------+
5 rows in set (0.00 sec)
CREATE TABLE loomakliinik(
id INT NOT NULL AURO_INCREMENT PRIMARY KEY,
külastusaeg DATETIME,
kaebus TEXT,
arst VARCHAR(30),
loomaliik VARCHAR(20),
kontakt VARCHAR(50),
arstikommentaar TEXT
summa DECIMAL(8, 2)
makstudaeg DATETIME
);
CREATE TABLE loomakliinik( id INT NOT NULL AURO_INCREMENT PRIMARY KEY, külastusaeg DATETIME, kaebus TEXT, arst VARCHAR(30), loomaliik VARCHAR(20), kontakt VARCHAR(50), arstikommentaar TEXT summa DECIMAL(8, 2) makstudaeg DATETIME );
CREATE TABLE loomakliinik(
id INT NOT NULL AUTO_INCREMENT PRIMARY KEY,
külastusaeg DATETIME,
kaebus TEXT,
arst VARCHAR(30),
loomaliik VARCHAR(20),
kontakt VARCHAR(50),
arstikommentaar TEXT
summa DECIMAL(8, 2)
makstudaeg DATETIME
);
CREATE TABLE loomakliinik( id INT NOT NULL AUTO_INCREMENT PRIMARY KEY, külastusaeg DATETIME, kaebus TEXT, arst VARCHAR(30), loomaliik VARCHAR(20), kontakt VARCHAR(50), arstikommentaar TEXT summa DECIMAL(8, 2) makstudaeg DATETIME );
CREATE TABLE loomakliinik(
id INT NOT NULL AUTO_INCREMENT PRIMARY KEY,
külastusaeg DATETIME,
kaebus TEXT,
arst VARCHAR(30),
loomaliik VARCHAR(20),
kontakt VARCHAR(50),
arstikommentaar TEXT,
summa DECIMAL(8, 2),
makstudaeg DATETIME
);
CREATE TABLE loomakliinik( id INT NOT NULL AUTO_INCREMENT PRIMARY KEY, külastusaeg DATETIME, kaebus TEXT, arst VARCHAR(30), loomaliik VARCHAR(20), kontakt VARCHAR(50), arstikommentaar TEXT, summa DECIMAL(8, 2), makstudaeg DATETIME );
SELECT * FROM loomakliinik
;
INSERT INTO loomakliinik (külastusaeg, kaebus, arst, loomaliik, kontakt)
  VALUES ('2016-09-16 10:30'. 'Kirbud', 'Tamm', 'Kass', 'juku@eesti.ee');
INSERT INTO loomakliinik (külastusaeg, kaebus, arst, loomaliik, kontakt)   VALUES ('2016-09-16 10:30'. 'Kirbud', 'Tamm', 'Kass', 'juku@eesti.ee');
  
INSERT INTO loomakliinik (külastusaeg, kaebus, arst, loomaliik, kontakt)
  VALUES ('2016-09-16 11:00'. 'Kirbud', 'Tamm', 'Koer', 'kati@eesti.ee');INSERT INTO loomakliinik (külastusaeg, kaebus, arst, loomaliik, kontakt)
INSERT INTO loomakliinik (külastusaeg, kaebus, arst, loomaliik, kontakt)   VALUES ('2016-09-16 11:00'. 'Kirbud', 'Tamm', 'Koer', 'kati@eesti.ee');
  VALUES ('2016-09-16 10:30', 'Kirbud', 'Tamm', 'Kass', 'juku@eesti.ee');
INSERT INTO loomakliinik (külastusaeg, kaebus, arst, loomaliik, kontakt)   VALUES ('2016-09-16 10:30', 'Kirbud', 'Tamm', 'Kass', 'juku@eesti.ee');
  
INSERT INTO loomakliinik (külastusaeg, kaebus, arst, loomaliik, kontakt)
  VALUES ('2016-09-16 11:00', 'Kirbud', 'Tamm', 'Koer', 'kati@eesti.ee');
INSERT INTO loomakliinik (külastusaeg, kaebus, arst, loomaliik, kontakt)   VALUES ('2016-09-16 11:00', 'Kirbud', 'Tamm', 'Koer', 'kati@eesti.ee');
SELECT * FROM loomakliinik;
mysql> SELECT * FROM loomakliinik;
+----+---------------------+--------+------+-----------+---------------+-----------------+-------+------------+
| id | külastusaeg         | kaebus | arst | loomaliik | kontakt       | arstikommentaar | summa | makstudaeg |
+----+---------------------+--------+------+-----------+---------------+-----------------+-------+------------+
|  1 | 2016-09-16 10:30:00 | Kirbud | Tamm | Kass      | juku@eesti.ee | NULL            |  NULL | NULL       |
|  2 | 2016-09-16 11:00:00 | Kirbud | Tamm | Koer      | kati@eesti.ee | NULL            |  NULL | NULL       |
+----+---------------------+--------+------+-----------+---------------+-----------------+-------+------------+
2 rows in set (0.00 sec)
;
+----+---------------------+--------+------+-----------+---------------+-----------------+-------+------------+ | id | külastusaeg         | kaebus | arst | loomaliik | kontakt       | arstikommentaar | summa | makstudaeg | +----+---------------------+--------+------+-----------+---------------+-----------------+-------+------------+ |  1 | 2016-09-16 10:30:00 | Kirbud | Tamm | Kass      | juku@eesti.ee | NULL            |  NULL | NULL       | |  2 | 2016-09-16 11:00:00 | Kirbud | Tamm | Koer      | kati@eesti.ee | NULL            |  NULL | NULL       | +----+---------------------+--------+------+-----------+---------------+-----------------+-------+------------+ 2 rows in set (0.00 sec);
SELECT külastusaeg, kaebus, loomaliik, kontakt FROM loomakliinik
 WHERE arst='Tamm';
SELECT külastusaeg, kaebus, loomaliik, kontakt FROM loomakliinik  WHERE arst='Tamm';
+---------------------+--------+-----------+---------------+
| külastusaeg         | kaebus | loomaliik | kontakt       |
+---------------------+--------+-----------+---------------+
| 2016-09-16 10:30:00 | Kirbud | Kass      | juku@eesti.ee |
| 2016-09-16 11:00:00 | Kirbud | Koer      | kati@eesti.ee |
+---------------------+--------+-----------+---------------+
2 rows in set (0.00 sec)
SELECT külastusaeg FROM loomakliinik WHERE kontakt LIKE '%juku%'
;
+---------------------+--------+-----------+---------------+ | külastusaeg         | kaebus | loomaliik | kontakt       | +---------------------+--------+-----------+---------------+ | 2016-09-16 10:30:00 | Kirbud | Kass      | juku@eesti.ee | | 2016-09-16 11:00:00 | Kirbud | Koer      | kati@eesti.ee | +---------------------+--------+-----------+---------------+ 2 rows in set (0.00 sec) SELECT külastusaeg FROM loomakliinik WHERE kontakt LIKE '%juku%';
SELECT külastusaeg FROM loomakliinik WHERE kontakt LIKE '%juku%'
;
INSERT INTO loomakliinik (külastusaeg, kaebus, arst, loomaliik, kontakt)
  VALUES ('2016-09-16 11:00', 'Verejooks', 'Kask', 'Koer', 'juku@eesti.ee');
INSERT INTO loomakliinik (külastusaeg, kaebus, arst, loomaliik, kontakt)   VALUES ('2016-09-16 11:00', 'Verejooks', 'Kask', 'Koer', 'juku@eesti.ee');
SELECT külastusaeg FROM loomakliinik WHERE kontakt LIKE '%juku%';
SELECT id, külastusaeg, kaebus, loomaliik, kontakt FROM loomakliinik
  WHERE arst='Tamm'
;
SELECT id, külastusaeg, kaebus, loomaliik, kontakt FROM loomakliinik   WHERE arst='Tamm';
UPDATE loomakliinik SET
   arstikommentaar='kirbuvann tehtud, kirburohi',
   summa='25.12' WHERE id=2
;
UPDATE loomakliinik SET    arstikommentaar='kirbuvann tehtud, kirburohi',    summa='25.12' WHERE id=2;
SELECT * FROM loomakliinik;
+----+---------------------+-----------+------+-----------+---------------+-----------------------------+-------+------------+
| id | külastusaeg         | kaebus    | arst | loomaliik | kontakt       | arstikommentaar             | summa | makstudaeg |
+----+---------------------+-----------+------+-----------+---------------+-----------------------------+-------+------------+
|  1 | 2016-09-16 10:30:00 | Kirbud    | Tamm | Kass      | juku@eesti.ee | NULL                        |  NULL | NULL       |
|  2 | 2016-09-16 11:00:00 | Kirbud    | Tamm | Koer      | kati@eesti.ee | kirbuvann tehtud, kirburohi | 25.12 | NULL       |
|  3 | 2016-09-16 11:00:00 | Verejooks | Kask | Koer      | juku@eesti.ee | NULL                        |  NULL | NULL       |
+----+---------------------+-----------+------+-----------+---------------+-----------------------------+-------+------------+
;
+----+---------------------+-----------+------+-----------+---------------+-----------------------------+-------+------------+ | id | külastusaeg         | kaebus    | arst | loomaliik | kontakt       | arstikommentaar             | summa | makstudaeg | +----+---------------------+-----------+------+-----------+---------------+-----------------------------+-------+------------+ |  1 | 2016-09-16 10:30:00 | Kirbud    | Tamm | Kass      | juku@eesti.ee | NULL                        |  NULL | NULL       | |  2 | 2016-09-16 11:00:00 | Kirbud    | Tamm | Koer      | kati@eesti.ee | kirbuvann tehtud, kirburohi | 25.12 | NULL       | |  3 | 2016-09-16 11:00:00 | Verejooks | Kask | Koer      | juku@eesti.ee | NULL                        |  NULL | NULL       | +----+---------------------+-----------+------+-----------+---------------+-----------------------------+-------+------------+;
SELECT DATE(now())
;
INSERT INTO loomakliinik (külastusaeg, kaebus, arst, loomaliik, kontakt)
  VALUES ('2016-09-15 10:00', 'Verejooks', 'Kask', 'Koer', 'juku@eesti.ee');
INSERT INTO loomakliinik (külastusaeg, kaebus, arst, loomaliik, kontakt)   VALUES ('2016-09-15 10:00', 'Verejooks', 'Kask', 'Koer', 'juku@eesti.ee');
SELECT * FROM loomakliinik WHERE DATE (külastusaeg)=DATE(NOW());
UPDATE loomakliinik SET makstudaeg=NOW() WHERE id=4;
SELECT * FROM loomakliinik
;
+----+---------------------+-----------+------+-----------+---------------+-----------------------------+-------+---------------------+
| id | külastusaeg         | kaebus    | arst | loomaliik | kontakt       | arstikommentaar             | summa | makstudaeg          |
+----+---------------------+-----------+------+-----------+---------------+-----------------------------+-------+---------------------+
|  1 | 2016-09-16 10:30:00 | Kirbud    | Tamm | Kass      | juku@eesti.ee | NULL                        |  NULL | NULL                |
|  2 | 2016-09-16 11:00:00 | Kirbud    | Tamm | Koer      | kati@eesti.ee | kirbuvann tehtud, kirburohi | 25.12 | NULL                |
|  3 | 2016-09-16 11:00:00 | Verejooks | Kask | Koer      | juku@eesti.ee | NULL                        |  NULL | NULL                |
|  4 | 2016-09-15 10:00:00 | Verejooks | Kask | Koer      | juku@eesti.ee | NULL                        |  NULL | 2016-09-15 10:55:24 |
+----+---------------------+-----------+------+-----------+---------------+-----------------------------+-------+---------------------+
SELECT COUNT(*) FROM loomakliinik;
+----+---------------------+-----------+------+-----------+---------------+-----------------------------+-------+---------------------+ | id | külastusaeg         | kaebus    | arst | loomaliik | kontakt       | arstikommentaar             | summa | makstudaeg          | +----+---------------------+-----------+------+-----------+---------------+-----------------------------+-------+---------------------+ |  1 | 2016-09-16 10:30:00 | Kirbud    | Tamm | Kass      | juku@eesti.ee | NULL                        |  NULL | NULL                | |  2 | 2016-09-16 11:00:00 | Kirbud    | Tamm | Koer      | kati@eesti.ee | kirbuvann tehtud, kirburohi | 25.12 | NULL                | |  3 | 2016-09-16 11:00:00 | Verejooks | Kask | Koer      | juku@eesti.ee | NULL                        |  NULL | NULL                | |  4 | 2016-09-15 10:00:00 | Verejooks | Kask | Koer      | juku@eesti.ee | NULL                        |  NULL | 2016-09-15 10:55:24 | +----+---------------------+-----------+------+-----------+---------------+-----------------------------+-------+---------------------+ SELECT COUNT(*) FROM loomakliinik;
SELECT COUNT(*) FROM loomakliinik;
SELECT loomaliik, COUNT(*) FROM loomakliinik GROUP BY loomaliik;
+-----------+----------+
| loomaliik | COUNT(*) |
+-----------+----------+
| Kass      |        1 |
| Koer      |        3 |
+-----------+----------+
2 rows in set (0.00 sec)
;
+-----------+----------+ | loomaliik | COUNT(*) | +-----------+----------+ | Kass      |        1 | | Koer      |        3 | +-----------+----------+ 2 rows in set (0.00 sec);
SELECT kontakt, COUNT(*) FROM loomakliinik GROUP BY kontakt;
SELECT kontakt, COUNT(*) FROM loomakliinik GROUP BY kontakt, loomaliik;
SELECT kontakt,loomaliik, COUNT(*) FROM loomakliinik GROUP BY kontakt, loomaliik;
+---------------+-----------+----------+
| kontakt       | loomaliik | COUNT(*) |
+---------------+-----------+----------+
| juku@eesti.ee | Kass      |        1 |
| juku@eesti.ee | Koer      |        2 |
| kati@eesti.ee | Koer      |        1 |
+---------------+-----------+----------+
3 rows in set (0.00 sec)
;
+---------------+-----------+----------+ | kontakt       | loomaliik | COUNT(*) | +---------------+-----------+----------+ | juku@eesti.ee | Kass      |        1 | | juku@eesti.ee | Koer      |        2 | | kati@eesti.ee | Koer      |        1 | +---------------+-----------+----------+ 3 rows in set (0.00 sec);
SELECT kontakt, SUM(summa) FROM loomakliinik GROUP BY kontakt;
+---------------+------------+
| kontakt       | SUM(summa) |
+---------------+------------+
| juku@eesti.ee |       NULL |
| kati@eesti.ee |      25.12 |
+---------------+------------+
2 rows in set (0.00 sec)
;
+---------------+------------+ | kontakt       | SUM(summa) | +---------------+------------+ | juku@eesti.ee |       NULL | | kati@eesti.ee |      25.12 | +---------------+------------+ 2 rows in set (0.00 sec);
clear
;
clear;
